{
  "schemaVersion": 2,
  "engineVersion": "0.1",
  "qualityPolicy": "normal",
  "semantic": {
    "nodes": [
      {
        "id": "input",
        "type": "stereo-input",
        "ports": [
          {
            "id": "out-l",
            "signal": "audio",
            "direction": "output"
          },
          {
            "id": "out-r",
            "signal": "audio",
            "direction": "output"
          }
        ],
        "parameters": []
      },
      {
        "id": "input-left-half",
        "type": "gain",
        "ports": [
          {
            "id": "in",
            "signal": "audio",
            "direction": "input"
          },
          {
            "id": "gain-mod",
            "signal": "control",
            "direction": "input"
          },
          {
            "id": "out",
            "signal": "audio",
            "direction": "output"
          }
        ],
        "parameters": [
          {
            "id": "gain",
            "value": 0.5,
            "unit": "linear",
            "modulation": {
              "portId": "gain-mod",
              "amount": 1.0,
              "polarity": "bipolar",
              "clampMinimum": 0.0,
              "clampMaximum": 1.0
            }
          }
        ]
      },
      {
        "id": "input-right-half",
        "type": "gain",
        "ports": [
          {
            "id": "in",
            "signal": "audio",
            "direction": "input"
          },
          {
            "id": "gain-mod",
            "signal": "control",
            "direction": "input"
          },
          {
            "id": "out",
            "signal": "audio",
            "direction": "output"
          }
        ],
        "parameters": [
          {
            "id": "gain",
            "value": 0.5,
            "unit": "linear",
            "modulation": {
              "portId": "gain-mod",
              "amount": 1.0,
              "polarity": "bipolar",
              "clampMinimum": 0.0,
              "clampMaximum": 1.0
            }
          }
        ]
      },
      {
        "id": "input-mono",
        "type": "sum",
        "ports": [
          {
            "id": "in-a",
            "signal": "audio",
            "direction": "input"
          },
          {
            "id": "in-b",
            "signal": "audio",
            "direction": "input"
          },
          {
            "id": "out",
            "signal": "audio",
            "direction": "output"
          }
        ],
        "parameters": []
      },
      {
        "id": "input-diffusion-a",
        "type": "allpass",
        "ports": [
          {
            "id": "in",
            "signal": "audio",
            "direction": "input"
          },
          {
            "id": "delay-mod",
            "signal": "control",
            "direction": "input"
          },
          {
            "id": "coefficient-mod",
            "signal": "control",
            "direction": "input"
          },
          {
            "id": "out",
            "signal": "audio",
            "direction": "output"
          }
        ],
        "parameters": [
          {
            "id": "delay",
            "value": 3.7,
            "unit": "milliseconds",
            "modulation": {
              "portId": "delay-mod",
              "amount": 0.0,
              "polarity": "bipolar",
              "clampMinimum": 3.6990000000000003,
              "clampMaximum": 3.701
            }
          },
          {
            "id": "coefficient",
            "value": 0.53,
            "unit": "unitless",
            "modulation": {
              "portId": "coefficient-mod",
              "amount": 0.15,
              "polarity": "bipolar",
              "clampMinimum": 0.35,
              "clampMaximum": 0.72
            }
          }
        ]
      },
      {
        "id": "input-diffusion-b",
        "type": "allpass",
        "ports": [
          {
            "id": "in",
            "signal": "audio",
            "direction": "input"
          },
          {
            "id": "delay-mod",
            "signal": "control",
            "direction": "input"
          },
          {
            "id": "coefficient-mod",
            "signal": "control",
            "direction": "input"
          },
          {
            "id": "out",
            "signal": "audio",
            "direction": "output"
          }
        ],
        "parameters": [
          {
            "id": "delay",
            "value": 7.9,
            "unit": "milliseconds",
            "modulation": {
              "portId": "delay-mod",
              "amount": 0.0,
              "polarity": "bipolar",
              "clampMinimum": 7.899,
              "clampMaximum": 7.901000000000001
            }
          },
          {
            "id": "coefficient",
            "value": 0.53,
            "unit": "unitless",
            "modulation": {
              "portId": "coefficient-mod",
              "amount": 0.15,
              "polarity": "bipolar",
              "clampMinimum": 0.35,
              "clampMaximum": 0.72
            }
          }
        ]
      },
      {
        "id": "motion-a",
        "type": "lfo",
        "ports": [
          {
            "id": "frequency-mod",
            "signal": "control",
            "direction": "input"
          },
          {
            "id": "phase-mod",
            "signal": "control",
            "direction": "input"
          },
          {
            "id": "waveform-mod",
            "signal": "control",
            "direction": "input"
          },
          {
            "id": "run-mode-mod",
            "signal": "control",
            "direction": "input"
          },
          {
            "id": "out",
            "signal": "control",
            "direction": "output"
          }
        ],
        "parameters": [
          {
            "id": "frequency",
            "value": 0.083,
            "unit": "hertz",
            "modulation": {
              "portId": "frequency-mod",
              "amount": 0.12,
              "polarity": "bipolar",
              "clampMinimum": 0.01,
              "clampMaximum": 0.3
            }
          },
          {
            "id": "phase",
            "value": 0.0,
            "unit": "cycles",
            "modulation": {
              "portId": "phase-mod",
              "amount": 0.25,
              "polarity": "bipolar",
              "clampMinimum": 0.0,
              "clampMaximum": 0.999
            }
          },
          {
            "id": "waveform",
            "value": 0.0,
            "unit": "waveform",
            "modulation": {
              "portId": "waveform-mod",
              "amount": 1.0,
              "polarity": "bipolar",
              "clampMinimum": 0.0,
              "clampMaximum": 1.0
            }
          },
          {
            "id": "run-mode",
            "value": 0.0,
            "unit": "run-mode",
            "modulation": {
              "portId": "run-mode-mod",
              "amount": 1.0,
              "polarity": "bipolar",
              "clampMinimum": 0.0,
              "clampMaximum": 1.0
            }
          }
        ]
      },
      {
        "id": "motion-b",
        "type": "lfo",
        "ports": [
          {
            "id": "frequency-mod",
            "signal": "control",
            "direction": "input"
          },
          {
            "id": "phase-mod",
            "signal": "control",
            "direction": "input"
          },
          {
            "id": "waveform-mod",
            "signal": "control",
            "direction": "input"
          },
          {
            "id": "run-mode-mod",
            "signal": "control",
            "direction": "input"
          },
          {
            "id": "out",
            "signal": "control",
            "direction": "output"
          }
        ],
        "parameters": [
          {
            "id": "frequency",
            "value": 0.057,
            "unit": "hertz",
            "modulation": {
              "portId": "frequency-mod",
              "amount": 0.12,
              "polarity": "bipolar",
              "clampMinimum": 0.01,
              "clampMaximum": 0.3
            }
          },
          {
            "id": "phase",
            "value": 0.37,
            "unit": "cycles",
            "modulation": {
              "portId": "phase-mod",
              "amount": 0.25,
              "polarity": "bipolar",
              "clampMinimum": 0.0,
              "clampMaximum": 0.999
            }
          },
          {
            "id": "waveform",
            "value": 0.0,
            "unit": "waveform",
            "modulation": {
              "portId": "waveform-mod",
              "amount": 1.0,
              "polarity": "bipolar",
              "clampMinimum": 0.0,
              "clampMaximum": 1.0
            }
          },
          {
            "id": "run-mode",
            "value": 0.0,
            "unit": "run-mode",
            "modulation": {
              "portId": "run-mode-mod",
              "amount": 1.0,
              "polarity": "bipolar",
              "clampMinimum": 0.0,
              "clampMaximum": 1.0
            }
          }
        ]
      },
      {
        "id": "size-macro",
        "type": "macro",
        "ports": [
          {
            "id": "out",
            "signal": "control",
            "direction": "output"
          }
        ],
        "parameters": [
          {
            "id": "value",
            "value": 0.0,
            "unit": "normalized"
          },
          {
            "id": "default-value",
            "value": 0.0,
            "unit": "normalized"
          },
          {
            "id": "center-detent",
            "value": 1.0,
            "unit": "boolean"
          }
        ],
        "name": "Size"
      },
      {
        "id": "decay-macro",
        "type": "macro",
        "ports": [
          {